{"schema_version":"2.2.0","source_base64":"JVBERi0xLjQKJSVFT0YK","content_type":"application/pdf","reviewed_ficha":{"repository_commit":"1111111111111111111111111111111111111111","path":"B.BIOREDOX/evidence/source.md","linkage_state":"reviewed"},"lawful_use_decision":"approved","auth":{"event_id":"bbbbbbbbbbbbbbbbbbbbbbbbbbbbbbbbbbbbbbbbbbbbbbbbbbbbbbbbbbbbbbbb","principal_id":"aaaaaaaaaaaaaaaaaaaaaaaaaaaaaaaaaaaaaaaaaaaaaaaaaaaaaaaaaaaaaaaa","method":"POST","url":"/v2/source_admit","created_at":1780000000,"expires_at":1780000060,"payload_canonicalization":"rfc8785-json-excluding-auth","payload_sha256":"cccccccccccccccccccccccccccccccccccccccccccccccccccccccccccccccc","collection":"nanolime"},"original_filename":"assay-source.pdf"}
